{
  "version": 1,
  "updated_at": "2026-10-06T07:00:00+09:00",
  "is_sample": true,
  "note": "예시 데이터입니다. 실제 뉴스가 아니며, 매일 아침 콘텐츠 봇이 이 파일을 실제 데이터로 교체합니다.",
  "buildings": {
    "pcbang": {
      "name": "PC방",
      "speaker": "PC방 사장님",
      "greeting": "어서 와! 오늘 게임계 소식 들려줄게.",
      "items": [
        {
          "title": "(예시) 인기 MMORPG 가을 대규모 업데이트",
          "lines": [
            "(예시) 신규 지역과 레이드가 추가된다는 가상의 소식이야.",
            "실제 게임 이름이나 날짜는 콘텐츠 봇이 채워 넣을 거야."
          ],
          "source": "https://example.com/game-news/1"
        },
        {
          "title": "(예시) e스포츠 리그 결승전 일정 발표",
          "lines": [
            "(예시) 이번 주말 결승전이 열린다는 샘플 문장이야. 친구들이랑 단체 관람 어때?"
          ]
        }
      ]
    },
    "cooking": {
      "name": "요리학원",
      "speaker": "요리 선생님",
      "items": [
        {
          "title": "(예시) 제철 식재료: 가을 버섯",
          "lines": [
            "(예시) 가을엔 버섯 요리가 제격이에요. 이건 샘플 데이터랍니다.",
            "버터에 살짝 볶아서 소금, 후추만 뿌려도 맛있어요."
          ],
          "source": "https://example.com/recipe/mushroom"
        }
      ]
    },
    "entertainment": {
      "name": "엔터테인먼트 회사",
      "speaker": "매니저",
      "items": [
        {
          "title": "(예시) 신인 아이돌 그룹 데뷔 쇼케이스",
          "lines": [
            "(예시) 가상의 신인 그룹이 쇼케이스를 연다는 샘플 소식이에요.",
            "실제 연예 뉴스는 매일 아침 업데이트될 예정이에요."
          ]
        }
      ]
    },
    "sports": {
      "name": "스포츠센터",
      "speaker": "트레이너",
      "items": []
    },
    "newscenter": {
      "name": "뉴스 센터",
      "speaker": "뉴스 센터 앵커",
      "greeting": "오늘의 주요 뉴스를 분야별로 전해 드려요. (지금은 예시 데이터예요)",
      "categories": [
        {
          "id": "politics",
          "label": "국내 정치·시사",
          "items": [
            {
              "title": "(예시) 가상의 '푸른시' 의회, 새 공원 조성 예산안 논의",
              "lines": [
                "(예시) 실제 사건이 아닌 샘플 기사예요. 가상의 도시 의회가 공원 예산을 논의했다는 내용이에요.",
                "실제 뉴스는 매일 아침 콘텐츠 봇이 이 자리에 채워 넣어요."
              ],
              "source": "https://example.com/news/politics/1",
              "published_at": "2026-10-07T07:00:00+09:00"
            },
            {
              "title": "(예시) 가상의 시민 토론회, '도서관 운영 시간' 주제로 열려",
              "lines": [
                "(예시) 등장하는 단체와 장소는 모두 지어낸 것이에요."
              ],
              "published_at": "2026-10-07T06:30:00+09:00"
            }
          ]
        },
        {
          "id": "economy",
          "label": "경제",
          "items": [
            {
              "title": "(예시) 가상의 '도트마트', 가을 제철 과일 할인 행사",
              "lines": [
                "(예시) 샘플 경제 기사예요. 실제 기업이나 수치가 아니에요.",
                "사과와 배 가격이 내렸다는 가상의 내용이에요."
              ],
              "source": "https://example.com/news/economy/1",
              "published_at": "2026-10-07T07:10:00+09:00"
            },
            {
              "title": "(예시) 가상 지표 '도트 물가지수' 소폭 상승",
              "lines": [
                "(예시) 이 지수는 존재하지 않는 예시용 지표예요."
              ]
            }
          ]
        },
        {
          "id": "society",
          "label": "사회·사건사고",
          "items": [
            {
              "title": "(예시) 가상의 동네 '별빛동', 길고양이 쉼터 문 열어",
              "lines": [
                "(예시) 지어낸 훈훈한 샘플 기사예요. 실제 지역이 아니에요."
              ],
              "source": "https://example.com/news/society/1",
              "published_at": "2026-10-07T06:50:00+09:00"
            }
          ]
        },
        {
          "id": "world",
          "label": "국제",
          "items": []
        }
      ]
    }
  }
}
